created_at,favorite_count,id,retweet_count,text
2017-09-08 12:41:32,68618,906135414498631680,16812,"Republicans, sorry, but I've been hearing about Repeal &amp; Replace for 7 years, didn't happen! Even worse, the Senate Filibuster Rule will...."
2017-09-08 12:37:14,98559,906134333467045888,19813,"Our incredible U.S. Coast Guard saved more than 15,000 lives last week with Harvey. Irma could be even tougher. We love our Coast Guard!"
2017-09-08 12:34:13,62032,906133573400481792,13638,"Hurricane Irma is of epic proportion, perhaps bigger than we have ever seen. Be safe and get out of its way,if possible. Federal G is ready!"
2017-09-08 01:33:38,77969,905967331662319617,15136,"We will confront ANY challenge, no matter how strong the winds or high the water. I’m proud to stand with Presidents for #OneAmericaAppeal."
2017-09-08 00:57:52,65856,905958330815926276,18613,I encourage EVERYONE in the path of #HurricaneIrma to heed the advice and orders of local &amp; state officials! https://t.co/AQmawTpZs0
2017-09-07 20:18:42,41097,905888075749974016,9774,"During my trip to Saudi Arabia, I spoke to the leaders of more than 50 Arab &amp; Muslim nations about the need to conf… https://t.co/BYdTMUEWcd"
2017-09-07 19:48:47,54387,905880546185814016,13360,"Together, we will show the world that the forces of destruction and extremism are NO MATCH for the BLESSINGS of PRO… https://t.co/kkzKdGIZlp"
2017-09-07 18:13:30,30665,905856569329504256,7430,"Welcome to the @WhiteHouse, Amir Sabah al-Ahmed al-Jaber al-Sabah of Kuwait! Joint press conference coming up soon:… https://t.co/Smy2Onu6iU"
2017-09-07 13:42:52,76726,905788459301908480,19507,"For all of those (DACA) that are concerned about your status during the 6 month period, you have nothing to worry about - No action!"
2017-09-07 12:53:07,0,905775939862310912,5145,"RT @GOP: .@IvankaTrump: This administration is committed to keeping working families at the forefront of our agenda.
https://t.co/rHqFqUJGWI"
2017-09-07 12:52:15,0,905775722312212480,6956,RT @WhiteHouse: The current tax code is a burden on American taxpayers and harmful to American job-creators. Learn more: https://t.co/w5eMl…
2017-09-07 12:51:35,0,905775554737078272,7577,"RT @GOP: .@POTUS: I want to work with Congress, Republicans, and Democrats on a plan that is pro-growth, pro-jobs, pro-worker, and pro-Amer…"
2017-09-07 12:51:12,45685,905775458557538304,12039,"Thank you, our great honor! https://t.co/StrciEwuWs"
2017-09-07 12:33:12,79810,905770927526432768,15988,"Hurricane Irma is raging but we have great teams of talented and brave people already in place and ready to help. Be careful, be safe! #FEMA"
2017-09-07 01:26:48,58943,905603224379559936,14689,"We want our companies to hire &amp; grow in AMERICA, to raise wages for AMERICAN workers, &amp; to help rebuild our AMERICA… https://t.co/Ng9NaVhyYI"
2017-09-07 00:18:49,68012,905586115440242689,16613,"If we want to renew our PROSPERITY, restore OPPORTUNITY, &amp; re-establish our economic DOMINANCE, then we need tax re… https://t.co/ICacqNxz89"
2017-09-07 00:04:12,32561,905582435538219011,6313,"Thank you for joining me in Mandan, ND Gov. @DougBurgum, Lt. Gov. @BrentSanfordND, @SenJohnHoeven, @RepKevinCramer… https://t.co/izfxODvl6c"
2017-09-06 23:20:48,41738,905571513398693888,8660,"Wonderful to be in North Dakota with the incredible hardworking men &amp; women @ the Andeavor Refinery. 
Full remarks:… https://t.co/zRRqfDv5qJ"
2017-09-06 19:26:09,70474,905512462971232257,17497,"Just spoke w/ Governors Rick Scott of Florida, Kenneth Mapp of the U.S. Virgin Islands &amp; Ricardo Rosselló of Puerto… https://t.co/NsyDhxS7wz"
2017-09-06 17:52:30,49202,905488897186172928,14157,"'President Donald J. Trump Approves Emergency Declarations'

➡️https://t.co/xSHSyNkvuP
➡️https://t.co/UbBSFOhMM7
➡️… https://t.co/jhfd4ZJ6L3"
2017-09-06 11:37:18,0,905394471969452032,11047,RT @VP: .@POTUS is committed to the health &amp; well-being of the US people &amp; we are confident Dr. Jerome Adams will succeed as our new surgeo…
2017-09-06 10:53:45,58089,905383515302264832,12667,Hurricane looks like largest ever recorded in the Atlantic!
2017-09-06 10:51:52,107065,905383039517282304,20915,"Watching Hurricane closely. My team, which has done, and is doing, such a good job in Texas, is already in Florida. No rest for the weary!"
2017-09-06 10:47:01,87469,905381817695526912,16957,Will be going to North Dakota today to discuss tax reform and tax cuts. We are the highest taxed nation in the world - that will change.
2017-09-06 00:38:27,89866,905228667336499200,23221,"Congress now has 6 months to legalize DACA (something the Obama Administration was unable to do). If they can't, I will revisit this issue!"
2017-09-05 20:45:27,100996,905170032229056512,23359,I look forward to working w/ D's + R's in Congress to address immigration reform in a way that puts hardworking citizens of our country 1st.
2017-09-05 12:50:00,0,905050380484141056,16872,"RT @The_Trump_Train: @realDonaldTrump Make no mistake, we are going to put the interest of AMERICAN CITIZENS FIRST! 

The forgotten men &amp; w…"
2017-09-05 12:36:57,121260,905047095488516098,31887,I am allowing Japan &amp; South Korea to buy a substantially increased amount of highly sophisticated military equipment from the United States.
2017-09-05 12:07:09,0,905039597050187777,5430,"RT @DanScavino: 'Trump as Commander in Chief, Making the Hard Decisions' by LTG (Ret) Kellogg, a highly decorated Vietnam War Vet: https://…"
2017-09-05 12:04:43,100774,905038986883850240,24675,"Congress, get ready to do your job - DACA!"
2017-09-05 02:49:26,96416,904899243906879488,25018,Big week coming up!
2017-09-04 16:38:46,117792,904745562771259392,26198,"We are building our future with American hands, American labor, American iron, aluminum and steel. Happy #LaborDay! https://t.co/lyvtNfQ5IO"
2017-09-03 16:14:31,165701,904377075049656322,44512,"The United States is considering, in addition to other options, stopping all trade with any country doing business with North Korea."
2017-09-03 16:07:32,125320,904375314830249984,26408,"I will be meeting General Kelly, General Mattis and other military leaders at the White House to discuss North Korea. Thank you."
2017-09-03 11:46:07,90720,904309527381716992,24481,"South Korea is finding, as I have told them, that their talk of appeasement with North Korea will not work, they only understand one thing!"
2017-09-03 11:39:38,90429,904307898213433344,23101,"..North Korea is a rogue nation which has become a great threat and embarrassment to China, which is trying to help but with little success."
2017-09-03 11:30:41,91555,904305644651634688,27121,North Korea has conducted a major Nuclear Test. Their words and actions continue to be very hostile and dangerous to the United States.....
2017-09-03 05:17:04,77388,904211620896886785,18777,So much SPIRIT in LA! Thank you to all of our HEREOS who saved many lives. An honor to spend time w/ @NationalGuard… https://t.co/z4PKmOxYno
2017-09-03 03:02:31,128473,904177758489776129,32070,"Remember, Sunday is National Prayer Day (by Presidential Proclamation)!"
2017-09-03 02:57:43,88673,904176553621307396,14796,"Just got back to the White House from the Great States of Texas and Louisiana, where things are going well. Such cooperation &amp; coordination!"
2017-09-03 02:50:58,67583,904174851627286530,13400,"The Manufacturing Index rose to 59%, the highest level since early 2011 - and we can do much better!"
2017-09-03 02:42:36,0,904172749135994882,25733,RT @Team_Trump45: @realDonaldTrump  https://t.co/o1x6X2qQdM
2017-09-03 02:41:40,0,904172511222525955,7304,RT @ColumbiaBugle: @realDonaldTrump @FLOTUS President Trump greeting families affected by Hurricane Harvey. #TexasStrong https://t.co/5Ga3d…
2017-09-03 02:40:24,0,904172194737123328,8802,RT @ColumbiaBugle: @realDonaldTrump Love our @FLOTUS! https://t.co/6LT9mLAJ86
2017-09-03 01:55:30,137099,904160894661296130,41038,"Together, we will prevail in the GREAT state of Texas. We love you!

GOD BLESS TEXAS &amp; GOD BLESS THE USA🇺🇸 https://t.co/1rzmEenQIb"
2017-09-02 16:56:51,107456,904025340049285121,25101,"TEXAS: We are with you today, we are with you tomorrow, and we will be with you EVERY SINGLE DAY AFTER, to restore,… https://t.co/bvb6OjveZu"
2017-09-02 13:58:37,76966,903980484966752257,14424,Departing for Texas and Louisiana with @FLOTUS Melania right now @JBA_NAFW. We will see you soon. America is with y… https://t.co/kdPDgwaxvw
2017-09-02 00:34:32,61079,903778130850131970,12838,"On behalf of @FLOTUS Melania &amp; myself, THANK YOU for today's update &amp; GREAT WORK! #SouthernBaptist @SendRelief,… https://t.co/4yZCeXCt6n"
2017-09-02 00:03:00,97336,903770196388831233,16499,I will be going to Texas and Louisiana tomorrow with First Lady. Great progress being made! Spending weekend working at White House.
2017-09-01 23:47:38,92733,903766326631698432,17117,Stock Market up 5 months in a row!
2017-09-01 19:47:23,76742,903705867891204096,23838,"'President Donald J. Trump Proclaims September 3, 2017, as a National Day of Prayer' #HurricaneHarvey #PrayForTexas… https://t.co/tOMfFWwEsN"
2017-09-01 12:58:48,95432,903603043714957312,17707,Texas is healing fast thanks to all of the great men &amp; women who have been working so hard. But still so much to do. Will be back tomorrow!
2017-09-01 12:47:46,67598,903600265420578819,13294,...get things done at a record clip. Many big decisions to be made over the coming days and weeks. AMERICA FIRST!
2017-09-01 12:35:27,73944,903597166249246720,13458,General John Kelly is doing a great job as Chief of Staff. I could not be happier or more impressed - and this Administration continues to..
2017-09-01 11:56:45,132282,903587428488839170,41258,"Wow, looks like James Comey exonerated Hillary Clinton long before the investigation was over...and so much more. A rigged system!"
2017-08-31 20:06:35,119460,903348312421670912,30608,"THANK YOU to all of the incredible HEROES in Texas. America is with you! #TexasStrong 
https://t.co/8N4ABo9Ihp"
2017-08-31 12:35:50,0,903234878124249090,6963,RT @FoxNews: .@KellyannePolls on Harvey recovery: We hope when it comes to basic Hurricane Harvey funding that we can rely upon a nonpartis…
2017-08-31 01:29:31,0,903067192756928512,8188,RT @SecShulkin: Our Mobile Vet Center set up and ready to help #Veterans impacted by #HurricaneHarvey in Corpus Christi. https://t.co/P3qNX…
2017-08-31 01:00:50,98612,903059975437733888,22219,First responders have been doing heroic work. Their courage &amp; devotion has saved countless lives – they represent t… https://t.co/Va37wntt1g
2017-08-31 00:50:13,0,903057301032108032,10430,RT @IvankaTrump: We must reform our tax code so that all Americans can succeed in our modern economy &amp; achieve the American Dream! #TaxRefo…
2017-08-30 19:38:41,96510,902978901223366656,26205,"Texas &amp; Louisiana: We are w/ you today, we are w/ you tomorrow, &amp; we will be w/ you EVERY SINGLE DAY AFTER, to rest… https://t.co/9AqR1L3fIQ"
2017-08-30 13:42:20,81131,902889225061896196,13621,Will be leaving for Missouri soon for a speech on tax cuts and tax reform - so badly needed!
2017-08-30 13:27:47,105910,902885560552960000,27361,"After reading the false reporting and even ferocious anger in some dying magazines, it makes me wonder, WHY? All I want to do is #MAGA!"
2017-08-30 13:12:29,115201,902881712010653697,23872,"After witnessing first hand the horror &amp; devastation caused by Hurricane Harvey,my heart goes out even more so to the great people of Texas!"
2017-08-30 12:47:52,107780,902875515534626817,27712,"The U.S. has been talking to North Korea, and paying them extortion money, for 25 years. Talking is not the answer!"
2017-08-29 16:06:57,0,902563229968228353,14730,RT @BrazoriaCounty: https://t.co/sUTyXBzer9
2017-08-29 12:26:55,77874,902507855584092160,16553,.@foxandfriends   We are not looking to fill all of those positions. Don't need many of them - reduce size of government. @IngrahamAngle
2017-08-29 12:10:30,139250,902503724274331653,21163,Leaving now for Texas!
2017-08-29 11:31:46,0,902493977533968384,7203,"RT @TheFive: ""Trump just won on law &amp; order and now he's delivering the goods."" -@jessebwatters #thefive"
2017-08-29 11:22:57,0,902491758235406346,7202,RT @TXMilitary: #PhotosFromTheField: Aerial photos from our rescue crews earlier today. #Harvey #TMDHarvey @USNationalGuard https://t.co/fA…
2017-08-29 11:22:40,0,902491685720076288,5000,"RT @NWSHouston: Historic flooding is still ongoing across the area. If evacuated, please DO NOT return home until authorities indicate it i…"
2017-08-28 13:13:16,0,902157132270899200,12199,RT @GregAbbott_TX: Thanks to the Texas National Guard for their help to rescue flooded Texans. #HurricaneHarvey https://t.co/lhpJtAne10
2017-08-28 13:11:47,0,902156761901264896,12262,"RT @Inspire_Us: No color, no religion, no nationality should come between us, we are all children of God. - Mother Teresa"
2017-08-28 13:08:54,0,902156034348904450,26244,"RT @KatiePavlich: Your boss pardoned a traitor who gave U.S. enemies state secrets, he also pardoned a terrorist who killed Americans. Spar…"
2017-08-28 13:08:39,0,902155972990382081,29807,"RT @DineshDSouza: Finally, as if by accident, the @washingtonpost breaks down &amp; admits the truth about where the violence is coming from ht…"
2017-08-27 23:01:06,106712,901942677461229569,21662,"HISTORIC rainfall in Houston, and all over Texas. Floods are unprecedented, and more rain coming. Spirit of the people is incredible.Thanks!"
2017-08-27 14:39:32,82772,901816453736919040,14922,Major rescue operations underway!
2017-08-27 14:31:35,53524,901814456505831424,10627,Going to a Cabinet Meeting (tele-conference) at 11:00 A.M. on #Harvey. Even experts have said they've never seen one like this!
2017-08-27 13:51:35,80157,901804388649500672,18446,"We are in the NAFTA (worst trade deal ever made) renegotiation process with Mexico &amp; Canada.Both being very difficult,may have to terminate?"
2017-08-27 13:44:11,100093,901802524981817344,25778,"With Mexico being one of the highest crime Nations in the world, we must have THE WALL. Mexico will pay for it through reimbursement/other."
2017-08-27 13:25:50,61204,901797906046439426,12770,"Wow - Now experts are calling #Harvey a once in 500 year flood! We have an all out effort going, and going well!"
2017-08-27 13:15:18,66595,901795255086968833,12018,"I will also be going to a wonderful state, Missouri, that I won by a lot in '16. Dem C.M. is opposed to big tax cuts. Republican will win S!"
2017-08-27 12:59:56,110089,901791391130554370,22091,I will be going to Texas as soon as that trip can be made without causing disruption. The focus must be life and safety.
2017-08-27 12:25:54,60365,901782823522185218,10268,Many people are now saying that this is the worst storm/hurricane they have ever seen. Good news is that we have great talent on the ground.
2017-08-27 12:04:05,77253,901777333513854976,13728,Great coordination between agencies at all levels of government. Continuing rains and flash floods are being dealt with. Thousands rescued.
2017-08-27 11:45:04,54842,901772550405070848,13852,"A great book by a great guy, highly recommended! https://t.co/3jbDDN8YmJ"
2017-08-26 22:57:22,90738,901579350662938624,17784,"Wonderful coordination between Federal, State and Local Governments in the Great State of Texas - TEAMWORK! Record setting rainfall."
2017-08-26 19:46:30,71998,901531320052051971,16400,THANK YOU to all of the great volunteers helping out with #HurricaneHarvey relief in Texas! https://t.co/Ds95oSgo8f
2017-08-26 11:52:19,75836,901411986302488576,14074,"Closely monitoring #HurricaneHarvey from Camp David. We are leaving nothing to chance. City, State and Federal Govs. working great together!"
2017-08-26 11:32:44,54732,901407059547226112,10704,".@ChuckGrassley - got your message loud and clear. We have fantastic people on the ground, got there long before #Harvey. So far, so good!"
2017-08-26 11:23:50,0,901404817008021505,6641,RT @VP: All Americans in harms way need to be prepared and should continue visiting https://t.co/2H22XpTtPj for critical updates on #Hurric…
2017-08-26 11:22:32,0,901404488610787328,4449,RT @EPAScottPruitt: Thoughts and prayers for those in Texas &amp; Louisiana. I am closely monitoring #Harvey developments along with @fema &amp; @E…
2017-08-26 11:21:54,46366,901404330024218624,8509,You are doing a great job - the world is watching! Be safe. https://t.co/PJLdxy3hD9
2017-08-26 11:17:16,0,901403166658498560,3555,RT @GovAbbott: To ensure your safety ahead of #Harvey heed warnings from local officials &amp; review important safety information. https://t.c…
2017-08-26 04:47:27,50260,901305065885114368,11653,We will remain fully engaged w/ open lines of communication as #HurricaneHarvey makes landfall. America is w/ you!… https://t.co/YyZodzPSqW
2017-08-26 02:00:33,143268,901263061511794688,33649,I am pleased to inform you that I have just granted a full Pardon to 85 year old American patriot Sheriff Joe Arpaio. He kept Arizona safe!
2017-08-26 01:46:26,136171,901259509632573440,28289,"At the request of the Governor of Texas, I have signed the Disaster Proclamation, which unleashes the full force of government help!"
2017-08-25 22:12:11,101019,901205593054162945,20264,Storm turned Hurricane is getting much bigger and more powerful than projected. Federal Government is on site and ready to respond. Be safe!
2017-08-25 21:12:08,64511,901190479798312961,11141,"Just arrived at Camp David, where I am monitoring the path and doings of Hurricane Harvey (as it strengthens to a Class 3). 125 MPH winds!"
2017-08-25 21:03:11,59876,901188228174184448,10316,"Just arrived at Camp David where I am closely watching the path and doings of Hurricane Harvey, as it strengthens to a Category 3. BE SAFE!"
2017-08-25 19:18:49,51178,901161964994539520,12454,I encourage everyone in the path of #HurricaneHarvey to heed the advice &amp; orders of their local and state officials. https://t.co/N6uEWCZUrv
2017-08-25 16:02:33,38321,901112569322237952,8204,"Received a #HurricaneHarvey briefing this morning from Acting @DHSgov Secretary Elaine Duke, @FEMA_Brock,… https://t.co/VGdeIdgLbO"
2017-08-25 15:46:40,57802,901108572041433089,12315,I have spoken w/ @GovAbbott of Texas and @LouisianaGov Edwards. Closely monitoring #HurricaneHarvey developments &amp; here to assist as needed.
2017-08-25 12:25:10,60775,901057864516734978,13841,Strange statement by Bob Corker considering that he is constantly asking me whether or not he should run again in '18. Tennessee not happy!
2017-08-25 11:32:23,68188,901044579750825985,15220,"Nick Adams, ""Retaking America""  ""Best things of this presidency aren't reported about. Convinced this will be perhaps best presidency ever."""
2017-08-25 10:44:17,70779,901032475111116800,15336,"Few, if any, Administrations have done more in just 7 months than the Trump A. Bills passed, regulations killed, border, military, ISIS, SC!"
2017-08-25 10:40:32,84055,901031532164468736,17850,General John Kelly is doing a fantastic job as Chief of Staff. There is tremendous spirit and talent in the W.H. Don't believe the Fake News
2017-08-25 10:33:32,66179,901029770401546243,17108,"If Senate Republicans don't get rid of the Filibuster Rule and go to a 51% majority, few bills will be passed. 8 Dems control the Senate!"
2017-08-25 10:25:06,0,901027651216969728,5445,RT @EricTrump: Honored to speak at the RNC Summer Meeting in Nashville Tennessee this evening! @GOP #MAGA @GOPChairwoman 🇺🇸🇺🇸🇺🇸 https://t.c…
2017-08-25 03:23:34,0,900921565868687360,9842,RT @GregAbbott_TX: Spoke with Pres. Trump &amp; heads of Homeland Security &amp; FEMA. They're helping Texas respond to #HurricaneHarvey. https://t…
2017-08-25 00:21:42,59454,900875799292776448,11946,A GREAT HONOR to spend time with our BRAVE HEROES at the @USMC Air Station Yuma. THANK YOU for your service to the… https://t.co/Q0Lp0gwVUG
2017-08-24 19:31:00,54013,900802642779267077,14893,"As #HurricaneHarvey intensifies - remember to #PlanAhead. 
☑️https://t.co/FMdmvohypy
☑️https://t.co/YL56ldeqoW 
☑️… https://t.co/Cos6udPjUK"
2017-08-24 17:13:38,55581,900768072503623680,12148,"On Tuesday, I visited with the incredible men &amp; women of @ICEgov &amp; @DHSgov Border Patrol in Yuma, AZ. Thank you. We… https://t.co/fN2EtWLhep"
2017-08-24 13:42:41,103693,900714982823821313,24392,"The only problem I have with Mitch McConnell is that, after hearing Repeal &amp; Replace for 7 years, he failed!That should NEVER have happened!"
2017-08-24 13:15:22,74424,900708110330978304,21565,"James Clapper, who famously got caught lying to Congress, is now an authority on Donald Trump. Will he show you his beautiful letter to me?"
2017-08-24 13:15:00,53172,900708017909506048,10541,"..(enthusiastic, dynamic and fun) and the American Legion - V.A. (respectful and strong). Too bad the Dems have no one who can change tones!"
2017-08-24 13:07:34,67372,900706146943717377,14273,"The Fake News is now complaining about my different types of back to back speeches. Well, there was Afghanistan (somber), the big Rally....."
2017-08-24 12:33:32,0,900697580946034688,25792,RT @JerryTravone: @realDonaldTrump  https://t.co/6XJxEg1gSs
2017-08-24 12:25:03,60279,900695448465399809,13060,...didn't do it so now we have a big deal with Dems holding them up (as usual) on Debt Ceiling approval. Could have been so easy-now a mess!
2017-08-24 12:19:45,62289,900694112940290049,16884,I requested that Mitch M &amp; Paul R tie the Debt Ceiling legislation into the popular V.A. Bill (which just passed) for easy approval. They...
2017-08-24 00:52:51,57582,900521251768213505,12209,"Donald E. Ballard, on behalf of the people of the United States, THANK YOU for your courageous service. YOU INSPIRE… https://t.co/gyNDamEaC5"
2017-08-23 22:41:19,47828,900488148194516992,10764,A great honor to sign the Veterans Appeals Improvement &amp; Modernization Act into law w/ @AmericanLegion @SecShulkin.… https://t.co/f8rF5fuNUW
2017-08-23 19:10:13,70682,900435023517499392,16688,"As long as we have faith in each other and confidence in our values, then there is no challenge too great for us to… https://t.co/1HUfW8er9I"
2017-08-23 13:50:52,78168,900354657133801474,19294,"If Republican Senate doesn't get rid of the Filibuster Rule &amp; go to a simple majority, which the Dems would do, they are just wasting time!"
2017-08-23 13:40:31,87623,900352052068401154,18863,Last night in Phoenix I read the things from my statements on Charlottesville that the Fake News Media didn't cover fairly. People got it!
2017-08-23 13:20:15,92800,900346953120141312,19354,"Phoenix crowd last night was amazing - a packed house. I love the Great State of Arizona. Not a fan of Jeff Flake, weak on crime &amp; border!"
2017-08-23 07:01:01,66153,900251514324647936,15509,MAKE AMERICA GREAT AGAIN! https://t.co/RzePiucV3h
2017-08-23 06:00:39,49916,900236323893673984,10778,#DrainTheSwamp #PhoenixRally https://t.co/o7S6xoCBiC
2017-08-23 05:32:50,94881,900229323801735168,26769,"Not only does the media give a platform to hate groups, but the media turns a blind eye to the gang violence on our… https://t.co/71xUYTbCul"
2017-08-23 05:18:29,56135,900225712522657792,12645,"Thank you Arizona. Beautiful turnout of 15,000 in Phoenix tonight! Full coverage of rally via my Facebook at:… https://t.co/BvbP9MkZPJ"
2017-08-23 00:20:52,88291,900150814081036288,19692,"THANK YOU to all of the great men and women at the U.S. Customs and Border Protection facility in Yuma, Arizona &amp; a… https://t.co/DX45ZnLYs1"
2017-08-22 23:12:04,68602,900133498723237888,16057,"We will push onward to victory w/hope in our hearts, courage in our souls &amp; everlasting pride in each &amp; every one o… https://t.co/yZfeo9Y56X"
2017-08-22 20:03:41,41033,900086092107571200,8427,"See you at 7:00 P.M. tonight Phoenix, Arizona! #MAGA🇺🇸
Tickets: https://t.co/2kUQfKqbsx https://t.co/1w3LVkpESE"
2017-08-22 19:15:40,69531,900074005205528578,15795,"We pray for our fallen heroes who died while serving our country in the @USNavy aboard the  #USSJohnSMcCain, and th… https://t.co/76Nn5liWrK"
2017-08-22 10:46:29,88215,899945866991206400,14843,"Was with great people last night in Fort Myer, Virginia. The future of our country is strong!"
2017-08-22 03:50:09,52841,899841094761848832,13296,"Address to the Nation
Full Video &amp; Transcript:
https://t.co/FELdImTuUM https://t.co/6ly3fNatiX"
2017-08-22 03:20:50,72957,899833714363949056,14739,"Thank you to the men and women of Fort Myer, and every member of the U.S. Military at home and abroad. #USA🇺🇸 https://t.co/ticezYKkhz"
2017-08-22 03:01:28,0,899828842075967489,7888,RT @marcorubio: Good #AfghanStrategy &amp; excellent speech by @POTUS laying it out to the nation.
2017-08-22 01:00:10,41390,899798313997926401,5965,"Join me live from Fort Myer in Arlington, Virginia. 
➡️https://t.co/LOV4StdJDj"
2017-08-21 13:32:06,83835,899625157421039616,19802,"Thank you, the very dishonest Fake News Media is out of control! https://t.co/8J7y900VGK"
2017-08-21 13:27:12,73941,899623926082535425,15381,Jerry Falwell of Liberty University was fantastic on @foxandfriends. The Fake News should listen to what he had to say. Thanks Jerry!
2017-08-21 03:01:01,83890,899466340238491648,20261,Thoughts &amp; prayers are w/ our @USNavy sailors aboard the #USSJohnSMcCain where search &amp; rescue efforts are underway. https://t.co/DQU0zTRXNU
2017-08-20 23:22:07,125376,899411254061694979,27456,Heading back to Washington after working hard and watching some of the worst and most dishonest Fake News reporting I have ever seen!
