created_at,favorite_count,id,retweet_count,text
2017-12-13 14:45:48,100114,940955920967880704,19415,"If last night’s election proved anything, it proved that we need to put up GREAT Republican candidates to increase… https://t.co/H4IWrlwWwl"
2017-12-13 13:02:52,117700,940930017365778432,28366,"Wow, more than 90% of Fake News Media coverage of me is negative, with numerous forced retractions of untrue storie… https://t.co/nyZJca6Hnm"
2017-12-13 11:22:04,74201,940904649728708609,14662,"The reason I originally endorsed Luther Strange (and his numbers went up mightily), is that I said Roy Moore will n… https://t.co/DcgJPmLTXy"
2017-12-13 04:08:41,120691,940795587733151744,23945,"Congratulations to Doug Jones on a hard fought victory. The write-in votes played a very big factor, but a win is a… https://t.co/QLFQ88UaLM"
2017-12-12 22:13:12,75905,940706127309926400,16863,Wishing all of those celebrating #Hanukkah around the world a happy and healthy eight nights in the company of thos… https://t.co/ZTNEFIV6cB
2017-12-12 14:23:55,90547,940588025964265472,19496,"Consumer Confidence is at an All-Time High, along with a Record High Stock Market. Unemployment is at a 17 year low… https://t.co/zeDQbntlYG"
2017-12-12 14:09:26,79531,940584383605563392,20710,"The people of Alabama will do the right thing. Doug Jones is Pro-Abortion, weak on Crime, Military and Illegal Immi… https://t.co/yv1IbXRYEj"
2017-12-12 13:03:35,86633,940567812053053441,22351,"Lightweight Senator Kirsten Gillibrand, a total flunky for Chuck Schumer and someone who would come to my office “b… https://t.co/L8fAyMgZ8M"
2017-12-12 12:10:58,144891,940554567414091776,36862,"Despite thousands of hours wasted and many millions of dollars spent, the Democrats have been unable to show any co… https://t.co/7KG6xKANGL"
2017-12-11 14:17:18,135538,940223974985871360,32596,"Another false story, this time in the Failing @nytimes, that I watch 4-8 hours of television a day - Wrong!  Also,… https://t.co/DMSmsmDUkF"
2017-12-10 21:18:40,117529,939967625362276354,29672,Very little discussion of all the purposely false and defamatory stories put out this week by the Fake News Media.… https://t.co/R8tTxg9AvK
2017-12-10 13:35:28,94127,939851058788134913,17701,Getting closer and closer on the Tax Cut Bill. Shaping up even better than projected. House and Senate working very… https://t.co/fKLVfqSmsK
2017-12-10 13:30:44,125114,939849867438034944,27954,"Things are going really well for our economy, a subject the Fake News spends as little time as possible discussing!… https://t.co/hZfaovKX9L"
2017-12-10 02:17:25,123152,939680422493073408,34418,No American should be separated from their loved ones because of preventable crime committed by those illegally in… https://t.co/leuQTYO8zk
2017-12-09 23:47:55,92227,939642796289470464,14865,Great Army - Navy Game. Army wins 14 to 13 and brings home the COMMANDER-IN-CHIEF’S TROPHY! Congratulations!
2017-12-09 23:14:34,87963,939634404267380736,23282,.@daveweigel of the Washington Post just admitted that his picture was a FAKE (fraud?) showing an almost empty aren… https://t.co/wERMFP0Wcp
2017-12-09 22:01:44,76193,939616077356642304,23730,".@DaveWeigel @WashingtonPost put out a phony photo of an empty arena hours before I arrived @ the venue, w/ thousan… https://t.co/3sbs38FyaF"
2017-12-09 18:37:31,52698,939564681743814661,10618,"Have a great game today, @USArmy and @USNavy - I will be watching. 

We love our U.S. Military. On behalf of an ent… https://t.co/zUH67y7RCl"
2017-12-09 18:19:31,64946,939560154269405184,14380,It was my great honor to celebrate the opening of two extraordinary museums-the Mississippi State History Museum &amp;… https://t.co/IN7JWc6lmT
2017-12-09 15:45:47,58689,939521466634326016,10311,"Heading to the great state of Mississippi at the invitation of their popular and respected Governor, @PhilBryantMS.… https://t.co/GcwoRmwaHp"
2017-12-09 13:21:24,145097,939485131693322240,36266,"CNN’S slogan is CNN, THE MOST TRUSTED NAME IN NEWS. Everyone knows this is not true, that this could, in fact, be a… https://t.co/FoPRXAVjsh"
2017-12-09 13:02:23,90838,939480342779580416,23010,"Fake News CNN made a vicious and purposeful mistake yesterday. They were caught red handed, just like lonely Brian… https://t.co/8OH18LzYbT"
2017-12-09 12:52:18,59177,939477807813595136,13426,A big contingent of very enthusiastic Roy Moore fans at the rally last night. We can’t have a Pelosi/Schumer Libera… https://t.co/XHOCKzdEh6
2017-12-09 12:41:39,73388,939475127552618496,13636,"GREAT EVENING last night in Pensacola, Florida. Arena was packed to the rafters, the crowd was loud, loving and rea… https://t.co/I0mrbhZT3g"
2017-12-09 06:06:03,68898,939375570919612416,16531,"We believe that every American should stand for the National Anthem, and we proudly pledge allegiance to one NATION… https://t.co/4GQmdSmiRk"
2017-12-09 04:46:05,77123,939355447273906182,20765,"This is your land, this is your home, and it's your voice that matters the most. So speak up, be heard, and fight,… https://t.co/u09Brwnow3"
2017-12-09 01:04:16,40329,939299624875118592,6878,Just arrived at the Pensacola Bay Center. Join me LIVE on @FoxNews in 10 minutes! #MAGA https://t.co/RQFqOkcpNV
2017-12-08 23:25:06,49141,939274666404909056,7853,"On my way to Pensacola, Florida. See everyone soon! #MAGA https://t.co/ijwxVSYQ52"
2017-12-08 19:02:27,64508,939208571253862400,17527,"“The unemployment rate remains at a 17-year low of 4.1%. The unemployment rate in manufacturing dropped to 2.6%, th… https://t.co/ujuFLRG8lc"
2017-12-08 17:46:21,66499,939189419386470401,14490,MAKE AMERICA GREAT AGAIN! https://t.co/64a93S07s7
2017-12-08 15:18:27,97142,939152197090148352,22210,Fines and penalties against Wells Fargo Bank for their bad acts against their customers and others will not be drop… https://t.co/Eg8RsLwJfA
2017-12-08 15:06:55,74099,939149296389251072,19007,LAST thing the Make America Great Again Agenda needs is a Liberal Democrat in Senate where we have so little margin… https://t.co/HaMncvh3Nc
2017-12-08 13:11:43,78671,939120304542101505,15205,"Big crowd expected today in Pensacola, Florida, for a Make America Great Again speech. We have done so much in so s… https://t.co/m4BiON3oo8"
2017-12-08 05:41:08,151093,939006911629869056,54244,I fulfilled my campaign promise - others didn’t! https://t.co/bYdaOHmPVJ
2017-12-08 05:36:09,48760,939005659982348291,10039,"Tonight, @FLOTUS Melania and I were thrilled to welcome so many wonderful friends to the @WhiteHouse – and wish the… https://t.co/NlHEGuiWCF"
2017-12-07 21:10:28,62728,938878398608433152,13392,"Across the battlefields, oceans, and harrowing skies of Europe and the Pacific throughout the war, one great battle… https://t.co/XelKHx4Ibo"
2017-12-07 20:52:49,61370,938873956345499654,12580,"Today, as we Remember Pearl Harbor, it was an incredible honor to be joined with surviving Veterans of the attack o… https://t.co/c4ZYnXSAuj"
2017-12-07 20:04:20,54757,938861758038577152,10452,"Today, the U.S. flag flies at half-staff at the @WhiteHouse, in honor of National Pearl Harbor Remembrance Day.… https://t.co/561NBdqSsb"
2017-12-07 16:16:19,80196,938804374079459329,21425,"Today, our entire nation pauses to REMEMBER PEARL HARBOR—and the brave warriors who on that day stood tall and foug… https://t.co/xGiAt5hdnu"
2017-12-07 15:04:54,105182,938786402992578560,22385,"National Pearl Harbor Remembrance Day - “A day that will live in infamy!” December 7, 1941"
2017-12-07 13:08:02,55064,938756989542457344,10043,Go get the new book on Andrew Jackson by Brian Kilmeade...Really good. @foxandfriends
2017-12-07 13:03:00,0,938755723902713861,7460,RT @EricTrump: #MakeAmericaGreatAgain https://t.co/YpfVHtq8tE
2017-12-07 12:49:16,0,938752267611721728,16271,RT @ChuckGrassley: Jerusalem Embassy Act of ‘95 (Senate vote 93-5 &amp; I voted for it) states embassy should be in Jerusalem by 5/31/99. For 1…
2017-12-06 21:14:41,132918,938517073508163584,38497,I have determined that it is time to officially recognize Jerusalem as the capital of Israel. I am also directing t… https://t.co/yG26qYMx0L
2017-12-06 18:05:04,46679,938469354089385985,12751,"Join me live from the @WhiteHouse via #Periscope
https://t.co/wLXKoISSTG"
2017-12-06 16:11:55,65810,938440878577856512,13568,Our thoughts and prayers are with everyone in the path of California’s wildfires. I encourage everyone to heed the… https://t.co/CO5bDgsj2t
2017-12-06 15:00:03,185237,938422792080457731,47102,MAKE AMERICA GREAT AGAIN!
2017-12-06 12:53:06,0,938390844327038977,9271,"RT @Scavino45: Time lapse video of the border wall prototypes, when they were being built in San Diego. Next phase underway: testing and ev…"
2017-12-05 23:13:28,50392,938184577255919623,12240,"Join me this Friday in Pensacola, Florida at the Pensacola Bay Center! Tickets: https://t.co/zA7SGgWqBE https://t.co/QzFdxQdgAL"
2017-12-05 17:46:45,66363,938102355878440960,14232,"Yesterday, I was thrilled to be with so many WONDERFUL friends, in Utah’s MAGNIFICENT Capitol.

It was my honor to… https://t.co/n4SbeI1JG7"
2017-12-04 12:35:39,73996,937661677700550656,18112,A must watch: Legal Scholar Alan Dershowitz was just on @foxandfriends talking of what is going on with respect to… https://t.co/EZ7cdgtUUo
2017-12-04 12:03:18,89377,937653535486959616,16240,"With the great vote on Cutting Taxes, this could be a big day for the Stock Market - and YOU!"
2017-12-04 12:00:08,94167,937652739001212928,21475,Putting Pelosi/Schumer Liberal Puppet Jones into office in Alabama would hurt our great Republican Agenda of low on… https://t.co/XBhLWc1Y4C
2017-12-04 11:17:05,95137,937641904338063361,25464,Democrats refusal to give even one vote for massive Tax Cuts is why we need Republican Roy Moore to win in Alabama.… https://t.co/cTTqHa3YXL
2017-12-03 13:36:45,124334,937314665176207360,37234,Report: “ANTI-TRUMP FBI AGENT LED CLINTON EMAIL PROBE”  Now it all starts to make sense!
2017-12-03 13:15:21,121591,937309279257792512,36077,People who lost money when the Stock Market went down 350 points based on the False and Dishonest reporting of Bria… https://t.co/4MT8wja1pn
2017-12-03 13:00:47,120205,937305615218696193,28964,"After years of Comey, with the phony and dishonest Clinton investigation (and more), running the FBI, its reputatio… https://t.co/gdbdgXZ57e"
2017-12-03 12:42:47,85910,937301085156503552,25405,"Tainted (no, very dishonest?) FBI “agent’s role in Clinton probe under review.” Led Clinton Email probe.… https://t.co/gpveJGRATD"
2017-12-03 12:27:54,69438,937297341266190336,18870,Such a total miscarriage of Justice in San Francisco! https://t.co/MSIkBCKF3t
2017-12-03 12:24:51,0,937296570256625666,13326,RT @paulsperry_: Wray needs to clean house. Now we know the politicization even worse than McCabe's ties to McAuliffe/Clinton. It also infe…
2017-12-03 11:46:02,0,937286804201451521,23550,RT @paulsperry_: BREAKING: top FBI investigator for Mueller--PETER STRZOK--busted sending political text messages bashing Trump &amp; praising…
2017-12-03 11:19:56,0,937280235384565760,8098,RT @GovChristie: .@POTUS has done more to combat the addiction crisis than any other President. https://t.co/EfjJVrE29G
2017-12-03 11:17:35,0,937279645254340608,14564,"RT @PressSec: The Trump effect: “The U.S. economy is running at its full potential for the first time in a decade” -WSJ
https://t.co/ee5N0z…"
2017-12-03 11:15:02,91824,937279001684598784,22013,I never asked Comey to stop investigating Flynn. Just more Fake News covering another Comey lie!
2017-12-03 02:22:40,104886,937145025359761408,26541,Congratulations to @ABC News for suspending Brian Ross for his horrendously inaccurate and dishonest report on the… https://t.co/wEVP4iGN6n
2017-12-03 02:13:28,112482,937142713211813889,32242,Many people in our Country are asking what the “Justice” Department is going to do about the fact that totally Croo… https://t.co/saIhU8YIrL
2017-12-03 02:06:54,141443,937141061343956992,42425,"So General Flynn lies to the FBI and his life is destroyed, while Crooked Hillary Clinton, on that now famous FBI h… https://t.co/OPFBHVaU1Z"
2017-12-03 01:50:15,78941,937136868608626689,14190,Great job First Lady Melania! https://t.co/TRuvaftPcD
2017-12-02 21:07:59,96646,937065834635292673,26304,"62 years ago this week, a brave seamstress in Montgomery, Alabama uttered one word that changed history... https://t.co/eOvCBcMIKX"
2017-12-02 17:14:13,113725,937007006526959618,30220,I had to fire General Flynn because he lied to the Vice President and the FBI. He has pled guilty to those lies. It… https://t.co/8bMCLGuAhf
2017-12-02 12:54:37,125588,936941673124425728,27445,Biggest Tax Bill and Tax Cuts in history just passed in the Senate. Now these great Republicans will be going for f… https://t.co/5hPQSNDZV3
2017-12-02 07:49:18,69945,936864840240398337,16706,We are one step closer to delivering MASSIVE tax cuts for working families across America. Special thanks to… https://t.co/L07UncQMZS
2017-12-01 21:49:27,59215,936713881711529986,15238,"Economists on the TAX CUTS and JOBS ACT:

“The enactment of a comprehensive overhaul - complete with a lower corpor… https://t.co/G7c2uDgMG5"
2017-12-01 20:08:22,88460,936688444046266368,25211,The media has been speculating that I fired Rex Tillerson or that he would be leaving soon - FAKE NEWS! He’s not le… https://t.co/tYYnq58Zmk
2017-12-01 17:23:17,0,936646898408218626,6525,RT @WhiteHouse: President Trump proclaims today as #WorldAIDSDay: https://t.co/AMqW8mWiak https://t.co/XGp8EelNzz
2017-12-01 11:21:06,80421,936555753946705920,17256,Republicans Senators are working hard to pass the biggest Tax Cuts in the history of our Country. The Bill is getti… https://t.co/GTBHcuUggn
2017-12-01 11:13:35,117628,936553863255031809,29878,The jury was not told the killer of Kate was a 7 time felon. The Schumer/Pelosi Democrats are so weak on Crime that… https://t.co/s5uFDixZoH
2017-12-01 11:03:35,127157,936551346299338752,34429,"The Kate Steinle killer came back and back over the weakly protected Obama border, always committing crimes and bei… https://t.co/5EjQfmTqYg"
2017-12-01 03:30:42,154663,936437372706836480,43517,A disgraceful verdict in the Kate Steinle case! No wonder the people of our Country are so angry with Illegal Immigration.
2017-12-01 00:42:21,151986,936395008139198464,47393,"The Christmas Story begins 2,000 years ago with a mother, a father, their baby son and the most extraordinary gift… https://t.co/SZLUM1jD27"
2017-12-01 00:36:40,111904,936393574433939456,28083,Today is a day that I’ve been looking very much forward to ALL YEAR LONG. It is one that you have heard me speak ab… https://t.co/OmcorwQCkR
2017-11-30 21:50:33,53488,936351772603568130,12638,"Our FIFTH 1K milestone of 2017!
#DOW24K #MAGA https://t.co/NoVt1uFp0y"
2017-11-30 21:00:50,46551,936339260218724353,10143,"Today, it was my great honor to meet with the Crown Prince of Bahrain at the @WhiteHouse. Bahrain and the United St… https://t.co/xShHfc3Yxo"
2017-11-30 19:26:42,51822,936315571708289026,14037,Thank you @SenOrrinHatch. Let’s continue MAKING AMERICA GREAT AGAIN! https://t.co/PIv9OAVZcf https://t.co/6egRvuwj1l
2017-11-30 15:46:39,97898,936260193536573440,21327,"The Dow just broke 24,000 for the first time (another all-time Record). If the Dems had won the Presidential Electi… https://t.co/A5LJPneB9D"
2017-11-30 13:05:21,86813,936219599422574592,15464,Stock Market hits new Record High. Confidence and enthusiasm abound. More great numbers coming out!
2017-11-30 12:25:00,74746,936209447747190784,16262,"The Chinese Envoy, who just returned from North Korea, seems to have had no impact on Little Rocket Man. Hard to be… https://t.co/ZySsGTqQHp"
2017-11-30 12:15:08,53264,936206961728786432,11947,The Failing @nytimes has totally gone against the Social Media Guidelines that they installed to preserve some cred… https://t.co/cWMMAc5jUq
2017-11-30 12:01:25,61857,936203511037136897,14324,"The Failing @nytimes, the pipe organ for the Democrat Party, has become a virtual lobbyist for them with regard to… https://t.co/Dcr4Tge2Wb"
2017-11-30 02:23:14,128953,936058006659321858,35761,Funny to hear the Democrats talking about the National Debt when President Obama doubled it in only 8 years!
2017-11-30 02:00:23,57800,936052257392676864,20075,"“Had the information (Crooked Hillary’s emails) been released there would have been harm to National Security....""… https://t.co/uYZYvT8xIo"
2017-11-30 01:09:42,78930,936039501474025473,17963,The only people who don’t like the Tax Cut Bill are the people that don’t understand it or the Obstructionist Democ… https://t.co/Kr5HJ8OLCQ
2017-11-30 01:03:30,72418,936037938898636800,23462,The House of Representatives seeks contempt citations(?) against the JusticeDepartment and the FBI for withholding… https://t.co/KrYQGAlt2h
2017-11-30 01:02:06,115022,936037588372283392,38331,".@Theresa_May, don’t focus on me, focus on the destructive Radical Islamic Terrorism that is taking place within th… https://t.co/d5BTTYaALh"
2017-11-30 00:40:59,51517,936032275980079104,12442,"Now, we have a once in a lifetime opportunity to RESTORE AMERICAN PROSPERITY – and RECLAIM AMERICA’S DESTINY.

But… https://t.co/HNvPxZHEIz"
2017-11-29 23:29:27,47874,936014271858831361,11145,"A vote to CUT TAXES is a vote to PUT AMERICA FIRST. It is time to take care of OUR WORKERS, to protect OUR COMMUNIT… https://t.co/WerIo83AE6"
2017-11-29 22:54:56,53786,936005585019002887,12114,"This week, the Senate can join the House &amp; take a strong stand for the Middle Class families who are the backbone o… https://t.co/ILfhlLOkSE"
2017-11-29 18:34:50,40089,935940131311190021,8096,"Departing @JBA_NAFW for St. Charles, Missouri to help push our plan for HISTORIC TAX CUTS across the finish line.… https://t.co/A9I7mvnhUD"
2017-11-29 14:49:14,48672,935883355547160577,11446,"Economy growing! Excluding hurricane effects, CEA estimates that real GDP growth would have been 3.9% in Q3.

Stock… https://t.co/ceei9Ux8MO"
2017-11-29 14:40:01,99509,935881037254725632,20120,Just spoke to President XI JINPING of China concerning the provocative actions of North Korea. Additional major san… https://t.co/h6Gq5vdcso
2017-11-29 14:14:19,85288,935874566701842434,22772,So now that Matt Lauer is gone when will the Fake News practitioners at NBC be terminating the contract of Phil Gri… https://t.co/6vWDKTgCQG
2017-11-29 12:16:21,98918,935844881825763328,25018,"Wow, Matt Lauer was just fired from NBC for “inappropriate sexual behavior in the workplace.” But when will the top… https://t.co/xvaYsbO0le"
2017-11-29 12:03:38,84078,935841679977910272,14732,Looks like another great day for the Stock Market. Consumer Confidence is at Record High. I guess somebody likes me (my policies)!
2017-11-29 11:49:18,66850,935838073618870272,16262,"Great, and we should boycott Fake News CNN. Dealing with them is a total waste of time! https://t.co/8zJ3j7g5el"
2017-11-29 11:32:46,37029,935833914761007114,7920,".@foxandfriends, we are in record territory in all things having to do with our economy! https://t.co/VB0Ao3s18d"
2017-11-29 11:28:32,0,935832847654576128,5388,RT @EricTrump: #MakeAmericaGreatAgain https://t.co/Q7AiR0buM2
2017-11-29 03:35:27,71381,935713791765110785,12899,Great day for Tax Cuts and the Republican Party. But the biggest Winner will be our great Country!
2017-11-29 03:30:50,43770,935712632409030656,7473,Great work Ivanka! https://t.co/AQL4JLvnDh
2017-11-29 03:28:33,80377,935712056690577414,15929,"Just won the lawsuit on leadership of Consumer Financial Protection Bureau, CFPB. A big win for the Consumer!"
2017-11-29 02:45:10,63573,935701139198181376,20203,"Charles McCullough, the respected fmr Intel Comm Inspector General, said public was misled on Crooked Hillary Email… https://t.co/P7nyHXxJ3R"
2017-11-29 01:45:50,94041,935686205429157888,23029,"After North Korea missile launch, it's more important than ever to fund our gov't &amp; military! Dems shouldn't hold t… https://t.co/lhXvhHiLES"
2017-11-28 23:45:55,0,935656027026051072,11473,"RT @narendramodi: Had a wonderful meeting with @IvankaTrump, advisor to @POTUS and leader of the US delegation at the @GES2017. https://t.c…"
2017-11-28 22:44:31,40322,935640578007687168,9299,“The Conference Board said that consumer sentiment was at its highest level in nearly 17 years in November. The Con… https://t.co/rAvKNXi52A
2017-11-28 22:30:12,46961,935636972252618753,10230,"Dow, S&amp;P 500 and Nasdaq all finished the day at new RECORD HIGHS! https://t.co/wJyB9d00hh"
2017-11-28 22:12:01,34038,935632396841562112,8165,"Remarks from the Roosevelt Room with @SenateMajLdr Mitch McConnell, @SpeakerRyan and Secretary of Defense, General… https://t.co/atei0EsluG"
2017-11-28 16:27:30,30092,935545697360891904,7048,“Statement from President Donald J. Trump on #GivingTuesday” https://t.co/NrfnmixAwR
2017-11-28 14:18:20,0,935513191374819328,9442,RT @IvankaTrump: It was an honor to meet with you Prime Minister Modi. Thank you for co-hosting the 8th annual Global Entrepreneurship Summ…
2017-11-28 14:17:46,84303,935513049729028096,20103,Meeting with “Chuck and Nancy” today about keeping government open and working. Problem is they want illegal immigr… https://t.co/jq3DYver4Q
2017-11-28 13:10:00,0,935495996116742144,7082,"RT @IvankaTrump: Thank you for the warm welcome. I’m excited to be in Hyderabad, India for #GES2017. https://t.co/1U08h5L9Rm"
2017-11-28 13:05:42,0,935494911989862401,43417,RT @FLOTUS: The decorations are up! @WhiteHouse is ready to celebrate! Wishing you a Merry Christmas &amp; joyous holiday season! https://t.co/…
2017-11-28 13:04:45,0,935494673744965637,3496,RT @statedeptspox: #GES2017 highlights the important role of women #entrepreneurs &amp; demonstrates the importance of #innovation &amp; partnershi…
2017-11-28 13:02:54,0,935494208164651008,11687,RT @FLOTUS: Had a wonderful visit from @JBA_NAFW children today at the @whitehouse! #WhiteHouseChristmas https://t.co/Hnw758zHzL
2017-11-28 13:00:34,111098,935493619204620288,17987,"Melania, our great and very hard working First Lady, who truly loves what she is doing, always thought that “if you… https://t.co/nW7uPnX48l"
2017-11-28 12:45:30,99049,935489831005810688,19833,At least 24 players kneeling this weekend at NFL stadiums that are now having a very hard time filling up. The Amer… https://t.co/n0YsDlZQ0C
2017-11-28 02:50:30,50419,935340092583006208,11472,Thank you Rand! https://t.co/NvPeleVmub
2017-11-28 02:48:53,76301,935339687006429185,15814,New home sales reach a 10 year high. Stock Market has more record gains. Hopefully Republican Senators will give us… https://t.co/DrEJ6caWjM
2017-11-27 14:24:36,82409,935152378747195392,15598,"The Tax Cut Bill is coming along very well, great support. With just a few changes, some mathematical, the middle c… https://t.co/P1gGkHVyxy"
2017-11-27 14:16:36,58273,935150368207654912,12840,"The good news is that their ratings are terrible, nobody cares! https://t.co/I7h4Ryin3h"
2017-11-27 14:04:51,150945,935147410472480769,40310,"We should have a contest as to which of the Networks, plus CNN and not including Fox, is the most dishonest, corrup… https://t.co/3f2NxPueRO"
2017-11-27 01:47:32,85436,934961858380955648,16492,"Back in D.C., big week for Tax Cuts and many other things of great importance to our Country.  Senate Republicans w… https://t.co/T9L8Z9CtyW"
2017-11-26 21:29:46,151606,934896989539586054,33439,"Since the first day I took office, all you hear is the phony Democrat excuse for losing the election, Russia, Russi… https://t.co/oZnstJiYYT"
2017-11-26 14:33:47,76619,934792302341521408,18324,I endorsed Luther Strange in the Alabama Primary. He shot way up in the polls but it wasn’t enough. Can’t let Schum… https://t.co/wT9pRKnk9Y
2017-11-26 13:52:36,100538,934781939088629761,25606,"The last thing we need in Alabama and the U.S. Senate is a Schumer/Pelosi puppet who is WEAK on Crime, WEAK on the… https://t.co/H01kbYd7Rp"
2017-11-25 23:25:54,67120,934563828834164739,19390,"Wow, even I didn’t realize we did so much. Wish the Fake News would report! Thank you. https://t.co/ApVbu2b0Jd"
2017-11-25 22:37:21,111863,934551607596986368,32643,".@FoxNews is MUCH more important in the United States than CNN, but outside of the U.S., CNN International is still… https://t.co/qzwpwVN2ep"
2017-11-25 22:00:11,44220,934542257222451206,9930,Check out the recent Editorial in the Wall Street Journal @WSJ about what a complete disaster the @CFPB has been un… https://t.co/tsg4wGBN0D
2017-11-25 21:48:16,70437,934539256940417024,14661,"The Consumer Financial Protection Bureau, or CFPB, has been a total disaster as run by the previous Administrations… https://t.co/PZOjFdB5H8"
2017-11-25 19:40:55,50953,934507210385829888,10980,"Happy #SmallBusinessSaturday!

A great day to support your community and America’s JOB creators by shopping locally… https://t.co/a0fME8HRXT"
2017-11-24 22:40:26,162220,934189999045693441,41864,"Time Magazine called to say that I was PROBABLY going to be named “Man (Person) of the Year,” like last year, but I… https://t.co/yFDS5Pz9yB"
2017-11-24 18:49:12,100330,934131805409697792,20181,"Will be calling the President of Egypt in a short while to discuss the tragic terrorist attack, with so much loss o… https://t.co/dG2jNyaok9"
2017-11-24 15:27:13,142355,934080974773776384,32595,Horrible and cowardly terrorist attack on innocent and defenseless worshipers in Egypt. The world cannot tolerate t… https://t.co/73hMjYKjMI
