created_at,favorite_count,id,retweet_count,text
2017-06-09 10:54:43,82539,873131235614347264,14074,Great reporting by @foxandfriends and so many others. Thank you!
2017-06-09 10:10:37,120962,873120139222306817,35232,"Despite so many false statements and lies, total and complete vindication...and WOW, Comey is a leaker!"
2017-06-07 12:17:13,87063,872427222392504320,16362,"Getting ready to leave for Cincinnati, in the GREAT STATE of OHIO, to meet with ObamaCare victims and talk Healthcare &amp; also Infrastructure!"
2017-06-07 11:44:37,94040,872419018799550464,23834,"I will be nominating Christopher A. Wray, a man of impeccable credentials, to be the new Director of the FBI. Details to follow."
2017-06-07 01:07:39,99974,872258719404482561,23731,Senate passed the VA Accountability Act. The House should get this bill to my desk ASAP! We can’t tolerate substandard care for our vets.
2017-06-07 00:44:56,40240,872253002266161153,7345,"#ICYMI: Announcement of Air Traffic Control Initiative 

Watch➡️https://t.co/IMiZr22gAw"
2017-06-07 00:06:50,43318,872243414930264065,8829,"Great meeting with @HouseGOP and @SenateGOP leaders, including @SpeakerRyan, @SenateMajLdr, @GOPLeader, @JohnCornyn… https://t.co/G03W8CEtCS"
2017-06-06 17:47:33,96973,872147965451882496,25796,Today we remember the courage and bravery of our troops that stormed the beaches of Normandy 73 years ago. #DDay… https://t.co/zhR24dMzYB
2017-06-06 13:44:55,66888,872086906804240384,38909,"...extremism, and all reference was pointing to Qatar. Perhaps this will be the beginning of the end to the horror of terrorism!"
2017-06-06 13:36:50,65295,872084870620520448,36774,So good to see the Saudi Arabia visit with the King and 50 countries already paying off. They said they would take a hard line on funding...
2017-06-06 12:15:36,103317,872064426568036353,25193,"Sorry folks, but if I would have relied on the Fake News of CNN, NBC, ABC, CBS, washpost or nytimes, I would have had ZERO chance winning WH"
2017-06-06 12:06:35,75170,872062159789985792,73589,During my recent trip to the Middle East I stated that there can no longer be funding of Radical Ideology. Leaders pointed to Qatar - look!
2017-06-06 11:58:00,108622,872059997429022722,26730,The FAKE MSM is working so hard trying to get me not to use Social Media. They hate that I can get the honest and unfiltered message out.
2017-06-06 10:51:39,69476,872043300949295104,12431,Big meeting today with Republican leadership concerning Tax Cuts and Healthcare. We are all pushing hard - must get it right!
2017-06-06 10:43:17,0,872041195618349056,8120,"RT @foxandfriends: FOX NEWS ALERT: ISIS claims responsibility for hostage siege in Melbourne, Australia that killed 1 person and injured 3…"
2017-06-06 10:41:25,0,872040726120550404,6693,RT @foxandfriends: Sen. Ted Cruz: Trump's air traffic control plan is a 'win-win' for Democrats and Republicans https://t.co/TsggUEfOO2
2017-06-06 01:20:17,117046,871899511525961728,30444,"That's right, we need a TRAVEL BAN for certain DANGEROUS countries, not some politically correct term that won't help us protect our people!"
2017-06-05 21:25:16,57711,871840367070412800,12338,"Today, I announced an Air Traffic Control Initiative to take American air travel into the future - finally!
➡️… https://t.co/NIIorkSRJN"
2017-06-05 20:45:05,42008,871830255396192256,9283,".@SecShulkin's decision is one of the biggest wins for our VETERANS in decades. Our HEROES deserve the best! 
➡️… https://t.co/RnNp9q7Tdh"
2017-06-05 13:49:56,91593,871725780535062528,27667,"Pathetic excuse by London Mayor Sadiq Khan who had to think fast on his ""no reason to be alarmed"" statement. MSM is working hard to sell it!"
2017-06-05 13:35:00,77255,871722020278587393,20332,".@foxandfriends  Dems are taking forever to approve my people, including Ambassadors. They are nothing but OBSTRUCTIONISTS! Want approvals."
2017-06-05 10:44:18,86647,871679061847879682,19380,In any event we are EXTREME VETTING people coming into the U.S. in order to help keep our country safe. The courts are slow and political!
2017-06-05 10:37:59,63824,871677472202477568,14373,The Justice Dept. should ask for an expedited hearing of the watered down Travel Ban before the Supreme Court - &amp; seek much tougher version!
2017-06-05 10:29:08,69008,871675245043888128,14828,"The Justice Dept. should have stayed with the original Travel Ban, not the watered down, politically correct version they submitted to S.C."
2017-06-05 10:25:02,86313,871674214356484096,20937,"People, the lawyers and the courts can call it whatever they want, but I am calling it what we need and what it is, a TRAVEL BAN!"
2017-06-04 11:43:30,160747,871331574649901056,47884,Do you notice we are not having a gun debate right now? That's because they used knives and a truck!
2017-06-04 11:31:00,155971,871328428963901440,60417,"At least 7 dead and 48 wounded in terror attack and Mayor of London says there is ""no reason to be alarmed!"""
2017-06-04 11:19:47,236601,871325606901895168,72583,We must stop being politically correct and get down to the business of security for our people. If we don't get smart it will only get worse
2017-06-03 23:24:45,256627,871145660036378624,62735,"Whatever the United States can do to help out in London and the U. K., we will be there - WE ARE WITH YOU. GOD BLESS!"
2017-06-03 23:17:13,171925,871143765473406976,51251,"We need to be smart, vigilant and tough. We need the courts to give us back our rights. We need the Travel Ban as an extra level of safety!"
2017-06-03 23:01:54,0,871139911298101248,7303,RT @DRUDGE_REPORT: Fears of new terror attack after van 'mows down 20 people' on London Bridge...
2017-06-03 19:35:33,50484,871087981225926656,11768,#WeeklyAddress🇺🇸 https://t.co/DNzRZiKxhd
2017-06-02 18:30:41,76134,870709271477932032,15900,"#MakeAmericaGreatAgain🇺🇸
https://t.co/eJxeVZ3A1r"
2017-06-02 10:40:22,0,870590911222349824,10780,RT @EricTrump: #MakeAmericaGreatAgain!!! 🇺🇸🇺🇸 https://t.co/MStWl628xe
2017-06-02 10:35:32,0,870589692294647808,1937,RT @HeyTammyBruce: Coming up at 720a ET on @foxandfriends! See you there! 🇺🇸 #maga
2017-06-02 10:34:42,0,870589482675916800,7254,RT @LindseyGrahamSC: I support President Trump’s desire to re-enter the Paris Accord after the agreement becomes a better deal for America…
2017-06-02 10:32:39,0,870588968475275264,7914,RT @GOPLeader: .@POTUS made the right call in leaving a deal that would have put an unnecessary burden on the United States. https://t.co/q…
2017-06-02 10:32:10,0,870588844793581569,9105,RT @Jim_Jordan: President Trump did the right thing by withdrawing us from Paris treaty - it would hurt American companies and American wor…
2017-06-02 10:31:03,0,870588565595578370,9294,"RT @VP: Our President is choosing to put American jobs, American consumers, American energy, and American industry first. https://t.co/y2Op…"
2017-06-02 10:08:24,0,870582867084050432,9258,RT @foxandfriends: Wall Street hits record highs after Trump pulls out of Climate pact https://t.co/PDmwj13Lus
2017-06-02 01:00:35,158903,870445001125355522,46824,MAKE AMERICA GREAT AGAIN!
2017-06-01 22:50:29,90387,870412262900740096,21768,"My job as President is to do everything within my power to give America a level playing field. #AmericaFirst🇺🇸
➡️… https://t.co/hL7OwbWzyi"
2017-06-01 19:03:10,37353,870355056327000065,6909,"Join me live at the @WhiteHouse.

➡️https://t.co/9VOb99W42r https://t.co/sjb5VHLHYH"
2017-06-01 11:05:21,89236,870234811616677889,24662,"The big story is the ""unmasking and surveillance"" of people that took place during the Obama Administration."
2017-06-01 01:05:17,76938,870083798981111808,16789,"I will be announcing my decision on Paris Accord, Thursday at 3:00 P.M.  The White House Rose Garden.  MAKE AMERICA GREAT AGAIN!"
2017-06-01 00:40:01,110683,870077441401905152,28199,"Crooked Hillary Clinton now blames everybody but herself, refuses to say she was a terrible candidate. Hits Facebook &amp; even Dems &amp; DNC."
2017-05-31 21:52:54,42164,870035383458963456,7202,"It was an honor to welcome the Prime Minister of Vietnam, Nguyễn Xuân Phúc to the @WhiteHouse this afternoon. https://t.co/6YbrIvJUCY"
2017-05-31 20:04:45,58271,870008165827575808,12738,"We traveled the world to strengthen long-standing alliances, and to form new partnerships. See more at:… https://t.co/FT4kyPoAl0"
2017-05-31 13:08:41,70297,869903459511918592,13453,I will be announcing my decision on the Paris Accord over the next few days. MAKE AMERICA GREAT AGAIN!
2017-05-31 13:05:14,63651,869902591005741056,11925,"Hopefully Republican Senators, good people all, can quickly get together and pass a new (repeal &amp; replace) HEALTHCARE bill. Add saved $'s."
2017-05-31 11:14:48,187191,869874798087819264,51146,"Kathy Griffin should be ashamed of herself. My children, especially my 11 year old son, Barron, are having a hard time with this. Sick!"
2017-05-31 10:45:27,57199,869867413776601088,12572,"...case against him &amp; now wants to clear his name by showing ""the false or misleading testimony by James Comey, John Brennan..."" Witch Hunt!"
2017-05-31 10:37:42,54145,869865463584620544,13397,"So now it is reported that the Democrats, who have excoriated Carter Page about Russia, don't want him to testify. He blows away their...."
2017-05-31 10:09:22,200986,869858333477523458,81041,"Who can figure out the true meaning of ""covfefe"" ???  Enjoy!"
2017-05-30 14:01:16,0,869554306806157312,7290,"RT @foxandfriends: Jared Kushner didn't suggest Russian communications channel in meeting, source says https://t.co/nF6bM1FEt1"
2017-05-30 14:00:50,0,869554194658844673,6064,RT @Scavino45: President Trump pays respects and  delivers #MemorialDay remarks at Arlington National Cemetery. https://t.co/D5rl948J6u
2017-05-30 13:59:28,75061,869553853750013953,19122,"The U.S. Senate should switch to 51 votes, immediately, and get Healthcare and TAX CUTS approved, fast and easy. Dems would do it, no doubt!"
2017-05-30 11:04:48,83149,869509894688387072,20877,Russian officials must be laughing at the U.S. &amp; how a lame excuse for why the Dems lost the election has taken over the Fake News.
2017-05-30 10:40:36,85775,869503804307275776,21595,"We have a MASSIVE trade deficit with Germany, plus they pay FAR LESS than they should on NATO &amp; military. Very bad for U.S. This will change"
2017-05-29 12:36:37,89271,869170615881793536,14498,I look forward to paying my respects to our brave men and women on this Memorial Day at Arlington National Cemetery later this morning.
2017-05-29 12:35:34,146714,869170351049240576,35373,"Today we remember the men and women who made the ultimate sacrifice in serving. Thank you, God bless your families &amp; God bless the USA!"
2017-05-29 12:18:52,63166,869166145894535169,12075,"North Korea has shown great disrespect for their neighbor, China, by shooting off yet another ballistic missile...but China is trying hard!"
2017-05-29 12:11:59,102811,869164414662049793,25806,"Honoring the men and women who made the ultimate sacrifice in service to America. Home of the free, because of the brave. #MemorialDay🇺🇸"
2017-05-29 00:20:11,111555,868985285207629825,28497,The Fake News Media works hard at disparaging &amp; demeaning my use of social media because they don't want America to hear the real story!
2017-05-29 00:07:01,72880,868981969664843777,15180,"The massive TAX CUTS/REFORM that I have submitted is moving along in the process very well, actually ahead of schedule. Big benefits to all!"
2017-05-28 23:57:19,67975,868979531641741313,13077,I suggest that we add more dollars to Healthcare and make it the best anywhere. ObamaCare is dead - the Republicans will do much better!
2017-05-28 14:43:53,67393,868840252227674113,15995,British Prime Minister May was very angry that the info the U.K. gave to U.S. about Manchester was leaked. Gave me full details!
2017-05-28 12:45:45,67865,868810522942164993,14242,Does anyone notice how the Montana Congressional race was such a big deal to Dems &amp; Fake News until the Republican won? V was poorly covered
2017-05-28 12:45:16,57527,868810404335673344,12704,....it is very possible that those sources don't exist but are made up by fake news writers. #FakeNews is the enemy!
2017-05-28 12:34:44,75093,868807754231820291,18320,"Whenever you see the words 'sources say' in the fake news media, and they don't mention names...."
2017-05-28 12:33:03,69192,868807327130025984,16835,It is my opinion that many of the leaks coming out of the White House are fabricated lies made up by the #FakeNews media.
2017-05-28 12:10:43,79412,868801710038372352,13701,Just returned from Europe. Trip was a great success for America. Hard work but big results!
2017-05-28 12:02:05,61464,868799536420065281,9266,Big win in Montana for Republicans!
2017-05-27 17:19:37,88916,868517059407335424,23569,"Bringing hundreds of billions of dollars back to the U.S.A. from the Middle East - which will mean JOBS, JOBS, JOBS!"
2017-05-27 16:22:01,41235,868502563347451904,7541,I look forward to reading the @CommerceGov 232 analysis of steel and aluminum- to be released in June. Will take major action if necessary.
2017-05-27 16:17:30,39939,868501423566315520,7168,"....""we push for the removal of all trade-distorting practices....to foster a truly level playing field."""
2017-05-27 16:16:47,44965,868501243823575040,7706,"Just left the #G7Summit. Had great meetings on everything, especially on trade where...."
2017-05-27 12:17:51,51816,868441116726710272,9994,I will make my final decision on the Paris Accord next week!
2017-05-27 10:03:12,73307,868407229380268033,15892,"Many NATO countries have agreed to step up payments considerably, as they should. Money is beginning to pour in- NATO will be much stronger."
2017-05-27 09:58:37,49095,868406076995235840,9111,"Big G7 meetings today. Lots of very important matters under discussion. First on the list, of course, is terrorism. #G7Taormina"
2017-05-26 20:39:51,60475,868205058743250944,11556,"On behalf of @FLOTUS Melania and myself, thank you for a wonderful dinner and evening, President Sergio Mattarella.… https://t.co/EhvWgjkRrY"
2017-05-26 20:26:55,71980,868201805934678017,19543,Terrorists are engaged in a war against civilization- it is up to all who value life to confront &amp; defeat this evil➡️https://t.co/haeuvCIF6I
2017-05-26 10:14:12,60770,868047612301148160,10866,"Getting ready to engage G7 leaders on many issues including economic growth, terrorism, and security."
2017-05-26 10:13:41,69819,868047480847568896,13214,Just arrived in Italy for the G7. Trip has been very successful. We made and saved the USA many billions of dollars and millions of jobs.
2017-05-25 22:44:57,52729,867874154497937408,9485,"Just arrived in Taormina with @FLOTUS Melania. 
#G7Summit #USA🇺🇸 https://t.co/l7aXolKBiK"
2017-05-25 20:06:09,70578,867834190078906370,16039,"Thank you for your support. Together, we will MAKE AMERICA SAFE AND GREAT AGAIN!
#POTUSAbroad #USA🇺🇸 https://t.co/42vCwr5GkA"
2017-05-25 17:54:17,48872,867801005018230786,10960,"Today's ceremony is a day for both remembrance and resolve.
#NATOMeeting #NATO https://t.co/YNZV3bTekB"
2017-05-25 14:33:51,0,867750567220715521,9786,RT @FLOTUS: Thank u to Queen Fabiola University Hospital! Enjoyed creating paper flowers with amazing patients &amp; getting a tour. #Brussels…
2017-05-24 20:11:18,55829,867473100434161664,10573,"Thank you for the warm welcome to Brussels, Belgium this afternoon! https://t.co/1AvYSameD4"
2017-05-24 12:20:07,107281,867354520526872576,24315,Honor of a lifetime to meet His Holiness Pope Francis. I leave the Vatican more determined than ever to pursue PEAC… https://t.co/Jhe7SROaxD
2017-05-23 15:58:37,116395,867047119974170625,28741,All civilized nations must join together to protect human life and the sacred right of our citizens to live in safety and in peace.
2017-05-23 15:47:21,65374,867044286352809984,12177,"Israel, Saudi Arabia and the Middle East were great. Trying hard for PEACE. Doing well. Heading to Vatican &amp; Pope, then #G7 and #NATO."
2017-05-23 15:43:16,59043,867043258932875264,9453,"Thank you for such a wonderful and unforgettable visit, Prime Minister @Netanyahu and @PresidentRuvi."
2017-05-23 12:04:48,137108,866988278184116224,32805,We stand in absolute solidarity with the people of the United Kingdom. https://t.co/X6fUUxxYXE
2017-05-22 20:14:46,64817,866749195297976320,13103,"Prime Minister @Netanyahu and @PresidentRuvi- on behalf of @FLOTUS Melania and myself, thank you for the invitation… https://t.co/Z5YCpaRV6t"
2017-05-22 13:13:48,0,866643258390302721,20022,"RT @netanyahu: Ever Stronger
חזקים תמיד
🇮🇱🇺🇸 https://t.co/Ecf5p4HjfZ"
2017-05-21 21:51:53,60267,866411249092902912,17415,#RiyadhSummit #POTUSAbroad🇺🇸 https://t.co/WdDEOiV6oS
2017-05-21 16:47:25,41803,866334629036384256,11056,"Speech transcript at Arab Islamic American Summit ➡️https://t.co/eUWxJXJxbe

Replay ➡️https://t.co/VtmlSqciXx

#RiyadhSummit #POTUSAbroad"
2017-05-21 11:15:30,0,866251096649588738,19260,RT @FLOTUS: I had a wonderful time with the students at the American International School #Riyadh today. #SaudiaArabia https://t.co/AVzVV0W…
2017-05-20 15:50:29,76246,865957909565366272,18739,"Thank you to the BRAVE servicemen &amp; women who have served, and continue to serve the United States- our true HEROES… https://t.co/ZTV9F639xM"
2017-05-20 09:44:31,89600,865865814099939328,83464,"Great to be in Riyadh, Saudi Arabia. Looking forward to the afternoon and evening ahead. #POTUSAbroad https://t.co/JJOra0KfyR"
2017-05-19 22:16:06,34909,865692565454106624,6911,"#WeeklyAddress🇺🇸
➡️https://t.co/UYEhgch4Hl https://t.co/HIQoFuc5cy"
2017-05-19 14:24:08,104145,865573793531478017,19597,Getting ready for my big foreign trip. Will be strongly protecting American interests - that's what I like to do!
2017-05-19 02:03:58,54319,865387523371143168,12161,"""President Donald J. Trump Proclaims 5/14/2017 through 5/20/2017 as #PoliceWeek""
Proclamation➡️… https://t.co/EcCsGaizWu"
2017-05-18 22:45:15,50262,865337513245913089,9671,"A great honor to welcome President Juan Manuel Santos of Colombia to the White House today!🇺🇸🇨🇴
Joint Press Conf➡️… https://t.co/uWfiQEdsaY"
2017-05-18 14:07:06,102624,865207118785372160,29285,"With all of the illegal acts that took place in the Clinton campaign &amp; Obama Administration, there was never a special counsel appointed!"
2017-05-18 11:52:14,117572,865173176854204416,34925,This is the single greatest witch hunt of a politician in American history!
2017-05-17 20:36:02,66983,864942610191978496,13083,It was my great honor to deliver the #CGACommencement17 at the @USCGAcademy. CONGRATULATIONS to the Class of 2017!… https://t.co/ehQanQXiSy
2017-05-16 19:38:42,72184,864565791076872192,18548,"It was a great honor to welcome the President of Turkey, Recep Tayyip Erdoğan, to the @WhiteHouse today! https://t.co/4BWjOCgnNv"
2017-05-16 16:02:17,50674,864511331029921792,11973,'U.S. Industrial Production Surged in April' https://t.co/S0Z4SEIRhi
2017-05-16 12:10:29,77517,864452996129853444,19141,"I have been asking Director Comey &amp; others, from the beginning of my administration, to find the LEAKERS in the intelligence community....."
2017-05-16 11:13:00,74222,864438529472049152,17362,"...to terrorism and airline flight safety. Humanitarian reasons, plus I want Russia to greatly step up their fight against ISIS &amp; terrorism."
2017-05-16 11:03:36,73916,864436162567471104,18863,"As President I wanted to share with Russia (at an openly scheduled W.H. meeting) which I have the absolute right to do, facts pertaining...."
2017-05-16 01:47:43,70101,864296272844529664,17638,"#PeaceOfficersMemorialDay and
#PoliceWeek Proclamation: https://t.co/o4IXVfZuHw https://t.co/UMJ6hklx4a"
2017-05-15 19:54:09,53299,864207293289771012,10864,"Today, I delivered remarks at the 36th Annual National Peace Officers' Memorial Service. 
#NationalPoliceWeek
Watch… https://t.co/3EioVDCTqb"
2017-05-14 15:13:45,130544,863774341921742848,21016,"Wishing @FLOTUS Melania and all of the great mothers out there a wonderful day ahead with family and friends! 

Happy #MothersDay"
2017-05-13 18:57:33,69596,863468271668002817,15048,"I was thrilled to be back @LibertyU. Congratulations to the Class of 2017! This is your day, and you've earned it.… https://t.co/87RYOPwBiY"
2017-05-13 17:54:31,44298,863452412459307009,7334,Will be interviewed by @JudgeJeanine on @FoxNews at 9:00 P.M. (Saturday night). Enjoy!
2017-05-13 00:47:58,44784,863194069891031041,10618,"#WeeklyAddress🇺🇸
➡️https://t.co/uT4K4fh88Y https://t.co/1iW7tVVNCH"
2017-05-12 21:16:56,50648,863140961114886144,10441,"Today, I welcomed the Victory Christian Center School. Good luck @ the Team America Rocketry Challenge! #TARC Watch… https://t.co/wFrRsK2wuo"
2017-05-12 21:09:32,54871,863139099825364994,11565,"Today, @FLOTUS hosted a Military Mother's Day Event in the East Room of the WH. It was an honor to stop by, say hel… https://t.co/wNVB0PYoef"
2017-05-12 13:20:04,120094,863020954427043840,29525,"China just agreed that the U.S. will be allowed to sell beef, and other major products, into China once again. This is REAL news!"
2017-05-12 12:54:54,69913,863014620516233216,17409,"When James Clapper himself, and virtually everyone else with knowledge of the witch hunt, says there is no collusion, when does it end?"
2017-05-12 12:26:15,73599,863007411132649473,24514,"James Comey better hope that there are no ""tapes"" of our conversations before he starts leaking to the press!"
2017-05-12 12:07:36,78247,863002719400976384,17967,"...Maybe the best thing to do would be to cancel all future ""press briefings"" and hand out written responses for the sake of accuracy???"
2017-05-12 11:59:00,60291,863000553265270786,12763,"As a very active President with lots of things happening, it is not possible for my surrogates to stand at podium with perfect accuracy!...."
2017-05-12 11:53:48,76153,862999243560288256,19253,The Fake Media is working overtime today!
2017-05-12 11:51:56,75583,862998775731818496,18629,"Again, the story that there was collusion between the Russians &amp; Trump campaign was fabricated by Dems as an excuse for losing the election."
2017-05-11 21:54:24,50720,862788002594127873,12440,"Yesterday, on the same day- I had meetings with Russian Foreign Minister Sergei Lavrov and the FM of Ukraine, Pavlo… https://t.co/hm4U54DCQO"
2017-05-11 20:34:25,90856,862767872879325185,24294,Russia must be laughing up their sleeves watching as the U.S. tears itself apart over a Democrat EXCUSE for losing the election.
2017-05-11 19:55:34,117142,862758098892619780,39228,We finally agree on something Rosie. https://t.co/BSP5F3PgbZ
2017-05-11 19:35:22,39933,862753016193089536,9561,"'Presidential Executive Order on the Establishment of Presidential Advisory Commission on Election Integrity'
➡️… https://t.co/kVG8r7qZS5"
2017-05-11 19:34:00,36651,862752672683839488,8104,'Presidential Executive Order on Strengthening the Cybersecurity of Federal Networks and Critical Infrastructure'… https://t.co/kQDBvXPekk
2017-05-11 00:14:58,97015,862460991451344896,40130,"The Democrats should be ashamed. This is a disgrace!
#DrainTheSwamp https://t.co/UfbKEECm2V"
2017-05-10 19:23:52,91394,862387734492663808,24290,Dems have been complaining for months &amp; months about Dir. Comey. Now that he has been fired they PRETEND to be aggrieved. Phony hypocrites!
2017-05-10 12:57:16,55670,862290442129461249,15115,The Roger Stone report on @CNN is false - Fake News. Have not spoken to Roger in a long time - had nothing to do with my decision.
2017-05-10 12:39:59,59104,862286091759611905,13141,"caught, he cried like a baby and begged for forgiveness...and now he is judge &amp; jury. He should be the one who is investigated for his acts."
2017-05-10 12:30:51,54311,862283792559616000,13949,"years, as a pol in Connecticut, Blumenthal would talk of his great bravery and conquests in Vietnam - except he was never there. When...."
2017-05-10 12:24:32,55077,862282202188566529,14389,"Watching Senator Richard Blumenthal speak of Comey is a joke. ""Richie"" devised one of the greatest military frauds in U.S. history. For...."
2017-05-10 11:28:38,0,862268135944192000,8209,RT @DRUDGE_REPORT: 10 SCANDALS ON DIRECTOR'S WATCH... https://t.co/dnGY08wTBP
2017-05-10 11:27:13,71593,862267781336752128,17179,"Comey lost the confidence of almost everyone in Washington, Republican and Democrat alike. When things calm down, they will be thanking me!"
2017-05-10 11:21:02,0,862266225157689349,6940,"RT @DRUDGE_REPORT: MEXICO 2ND DEADLIEST COUNTRY; TOPS AFGHAN, IRAQ... https://t.co/i4FtSpLiHV"
2017-05-10 11:19:04,76757,862265729718128641,17591,"James Comey will be replaced by someone who will do a far better job, bringing back the spirit and prestige of the FBI."
2017-05-10 11:10:48,73320,862263649821503489,18569,"The Democrats have said some of the worst things about James Comey, including the fact that he should be fired, but now they play so sad!"
2017-05-10 02:42:52,91716,862135824745467905,28205,"Cryin' Chuck Schumer stated recently, ""I do not have confidence in him (James Comey) any longer."" Then acts so indignant.  #draintheswamp"
2017-05-09 21:38:51,42602,862059314277748736,9491,"'Manufacturing openings, hires rise to highest levels of the recovery'
https://t.co/txFZDYYIOe"
